{
  "schema_version": "1",
  "session_id": "fixture-empty-session-0001",
  "state": "submitting",
  "letter_provenance": {
    "schema_version": "1",
    "letter_fixture_id": "fictional-hainan-1954-001",
    "kind": "fixture",
    "fictional": true,
    "notice": "A fictional letter generated for this encounter"
  },
  "created_at": "2026-07-14T00:00:00Z",
  "first_ink_at": null,
  "submitted_at": "2026-07-14T00:00:30Z",
  "review_id": "fixture-empty-review-0001",
  "error_code": null,
  "strokes": [],
  "heart_rate": {
    "schema_version": "1",
    "consent": "declined",
    "source": "none",
    "samples": [],
    "gaps": []
  },
  "retention_deadline": "2026-07-21T00:00:30Z",
  "deletion_status": "active"
}
